id,question,answer,category
901,"What is the company policy on desk allocation for full-time employees in our workplace & facilities framework, scenario #3026?",Desk allocation is managed by Facilities and may change based on seating plans and team movement.,Workplace & Facilities
902,"What is the company policy on phone reimbursement for full-time employees in the compensation framework, scenario #375?",Eligible roles may claim mobile reimbursement up to ₹750 per month.,Compensation
903,"What is the company policy on coworking reimbursement for full-time employees in our remote work framework, scenario #1355?",The company reimburses up to ₹15000 per month for approved coworking space use in exceptional cases.,Remote Work
904,"What is the company policy on relocation support for support employees in the compensation framework, scenario #1887?",Relocation assistance up to ₹1200 is available for approved transfers subject to bills within 16 days.,Compensation
905,"What is the company policy on international travel for probationary employees in the travel policy framework, scenario #3244?",International travel requires approval from the function head at least 4 working days before departure.,Travel Policy
906,"What is the company policy on air travel for support employees in the travel policy framework, scenario #1477?","Employees at level 2 and above may book business class for flights longer than 5 hours, if approved.",Travel Policy
907,"What is the company policy on medical insurance for contract employees in our benefits framework, scenario #5734?",Medical insurance cover of ₹20000 is provided to eligible employees under the group policy.,Benefits
908,"What is the company policy on office timing for engineering employees in our workplace & facilities framework, scenario #8842?",Office facilities are generally accessible from 9:00 AM to 6:00 AM on business days.,Workplace & Facilities
909,"What is the company policy on manager feedback for sales employees in the performance management framework, scenario #9135?",Managers are expected to provide formal feedback at least 10 time(s) per quarter.,Performance Management
910,"What is the company policy on dress code for probationary employees in our code of conduct framework, scenario #5234?",Employees are expected to follow smart casual dress standards on regular office days.,Code of Conduct
911,"What is the company policy on accident cover for sales employees in the benefits framework, scenario #6077?",Accident insurance cover of ₹500 is provided for employees on company rolls.,Benefits
912,"What is the company policy on whistleblower for support employees in the code of conduct framework, scenario #1942?",Whistleblower complaints may be made confidentially through the approved reporting channels.,Code of Conduct
913,"What is the company policy on vpn usage for support employees in the it & security framework, scenario #6001?",Remote access to internal systems must use the company VPN for all sessions involving restricted data.,IT & Security
914,"What is the company policy on conflict of interest for probationary employees in the code of conduct framework, scenario #5442?",Potential conflicts of interest must be disclosed within 5 days of becoming known.,Code of Conduct
915,"What is the company policy on working hours for sales employees in our attendance framework, scenario #8712?",Standard working hours are 8:00 PM to 6:30 PM with a 30-minute meal break.,Attendance
916,"What is the company policy on screen lock for sales employees in our it & security framework, scenario #4166?",Devices must auto-lock after 15 minutes of inactivity.,IT & Security
917,"What is the company policy on rehire policy for probationary employees in our recruitment framework, scenario #5413?","Former employees may be considered for rehire after a cooling period of 14 months, subject to records review.",Recruitment
918,"What is the company policy on knowledge transfer for managerial employees in our separation framework, scenario #9408?",Knowledge transfer plan must be completed at least 1 working days before exit for critical roles.,Separation
919,"What is the company policy on bereavement leave for contract employees in the leave policy framework, scenario #1067?",Employees may take 8 working days of bereavement leave for immediate family members.,Leave Policy
920,"What is the company policy on travel allowance for support employees in our compensation framework, scenario #4068?",Domestic business travel provides a daily allowance of ₹1200 for meals and local transport.,Compensation
921,"What is the company policy on bonus payout for intern employees in the compensation framework, scenario #7656?","Annual performance bonus, where applicable, is paid in March after review completion.",Compensation
922,"What is the company policy on comp-off for probationary employees in the leave policy framework, scenario #1835?",Compensatory off earned for approved extra work must be used within 15 days of accrual.,Leave Policy
923,"What is the company policy on weekend work for sales employees in our attendance framework, scenario #8305?",Weekend work requires prior approval from the reporting manager and must be logged within 1 hours.,Attendance
924,"What is the company policy on training link for full-time employees in the performance management framework, scenario #4908?",Completion of mandatory learning may influence performance compliance if overdue by more than 30 days.,Performance Management
925,"What is the company policy on visa expense for managerial employees in the travel policy framework, scenario #4377?",Visa-related expenses for approved international travel are reimbursable through the standard expense process.,Travel Policy
926,"What is the company policy on unpaid leave for probationary employees in our leave policy framework, scenario #6184?",Unpaid leave beyond regular entitlement may be granted for up to 12 working days with management approval.,Leave Policy
927,"What is the company policy on goal setting for sales employees in our performance management framework, scenario #7423?",Employees must finalize annual goals within 25 days of the performance cycle start.,Performance Management
928,"What is the company policy on email retention for contract employees in the it & security framework, scenario #8234?",Official email records are retained for approximately 5 months in line with policy.,IT & Security
929,"What is the company policy on air travel for intern employees in our travel policy framework, scenario #362?","Employees at level 9 and above may book business class for flights longer than 9 hours, if approved.",Travel Policy
930,"What is the company policy on international travel for probationary employees in the travel policy framework, scenario #5599?",International travel requires approval from the function head at least 3 working days before departure.,Travel Policy
931,"What is the company policy on remote availability for probationary employees in the remote work framework, scenario #7028?",Employees working remotely must be reachable between 7:00 PM and 7:00 PM on official communication channels.,Remote Work
932,"What is the company policy on review frequency for full-time employees in the performance management framework, scenario #6566?",Performance reviews are conducted annually and documented in the HR system.,Performance Management
933,"What is the company policy on asset misuse for managerial employees in the code of conduct framework, scenario #9532?",Misuse of company property may result in recovery of costs and disciplinary action.,Code of Conduct
934,"What is the company policy on medical fitness for support employees in the recruitment framework, scenario #7828?",Roles requiring medical fitness clearance must complete the process within 18 days of offer acceptance.,Recruitment
935,"What is the company policy on performance improvement for probationary employees in the performance management framework, scenario #1639?",A performance improvement plan usually runs for 23 days with defined review checkpoints.,Performance Management
936,"What is the company policy on data deletion for full-time employees in our it & security framework, scenario #6145?",Data deletion requests involving employee records must follow approved retention schedules and authorization steps.,IT & Security
937,"What is the company policy on full and final settlement for support employees in our separation framework, scenario #8029?",Full and final settlement is generally processed within 26 days after separation documentation is complete.,Separation
938,"What is the company policy on substance policy for engineering employees in the code of conduct framework, scenario #3020?",Reporting to work under the influence of prohibited substances may lead to disciplinary action.,Code of Conduct
939,"What is the company policy on intern conversion for support employees in the recruitment framework, scenario #7405?",Intern-to-full-time conversion is evaluated during the final 23 weeks of internship.,Recruitment
940,"What is the company policy on candidate travel for support employees in the recruitment framework, scenario #6104?",Interview travel reimbursement must be claimed within 23 days of the interview date.,Recruitment
941,"What is the company policy on email retention for full-time employees in the it & security framework, scenario #2833?",Official email records are retained for approximately 18 months in line with policy.,IT & Security
942,"What is the company policy on travel advance for sales employees in the travel policy framework, scenario #3341?",Travel advance requests must be raised at least 29 working days before the trip.,Travel Policy
943,"What is the company policy on email retention for intern employees in our it & security framework, scenario #8423?",Official email records are retained for approximately 8 months in line with policy.,IT & Security
944,"What is the company policy on remote check-in for intern employees in our remote work framework, scenario #5547?",Remote employees must attend a team check-in at 9:00 AM on every Wednesday.,Remote Work
945,"What is the company policy on canteen subsidy for contract employees in our workplace & facilities framework, scenario #2726?",Eligible employees receive canteen subsidy of ₹1000 per working day.,Workplace & Facilities
946,"What is the company policy on gifts policy for support employees in our code of conduct framework, scenario #3185?",Employees may not accept gifts above ₹500000 without written approval.,Code of Conduct
947,"What is the company policy on carry forward for contract employees in our leave policy framework, scenario #7769?","Up to 20 unused annual leave days may be carried forward, subject to manager approval by December.",Leave Policy
948,"What is the company policy on email retention for contract employees in our it & security framework, scenario #9876?",Official email records are retained for approximately 17 months in line with policy.,IT & Security
949,"What is the company policy on air travel for full-time employees in our travel policy framework, scenario #9607?","Employees at level 15 and above may book business class for flights longer than 12 hours, if approved.",Travel Policy
950,"What is the company policy on mfa requirement for engineering employees in our it & security framework, scenario #4140?",Multi-factor authentication is mandatory for access to all critical systems.,IT & Security
951,"What is the company policy on remote check-in for intern employees in the remote work framework, scenario #2825?",Remote employees must attend a team check-in at 10:30 AM on every Tuesday.,Remote Work
952,"What is the company policy on mfa requirement for contract employees in our it & security framework, scenario #7111?",Multi-factor authentication is mandatory for access to all critical systems.,IT & Security
953,"What is the company policy on background check for managerial employees in the recruitment framework, scenario #9061?",Employment is subject to satisfactory background verification completed within approximately 2 weeks.,Recruitment
954,"What is the company policy on meal benefit for full-time employees in the benefits framework, scenario #60?",Eligible employees receive meal benefit support of up to ₹1000 per month.,Benefits
955,"What is the company policy on salary payment for engineering employees in our compensation framework, scenario #6389?",Monthly salary is credited on the 15th working day of each month.,Compensation
956,"What is the company policy on joining extension for support employees in our recruitment framework, scenario #688?",Joining date extensions up to 3 days may be approved by Talent Acquisition and the hiring manager.,Recruitment
957,"What is the company policy on data deletion for support employees in the it & security framework, scenario #8847?",Data deletion requests involving employee records must follow approved retention schedules and authorization steps.,IT & Security
958,"What is the company policy on probation length for managerial employees in the recruitment framework, scenario #9744?",Standard probation period is 18 months unless otherwise stated in the appointment letter.,Recruitment
959,"What is the company policy on bonus payout for engineering employees in our compensation framework, scenario #5499?","Annual performance bonus, where applicable, is paid in July after review completion.",Compensation
960,"What is the company policy on screen lock for sales employees in the it & security framework, scenario #7140?",Devices must auto-lock after 4 minutes of inactivity.,IT & Security
961,"What is the company policy on accident cover for probationary employees in our benefits framework, scenario #744?",Accident insurance cover of ₹100000 is provided for employees on company rolls.,Benefits
962,"What is the company policy on manager feedback for contract employees in our performance management framework, scenario #4508?",Managers are expected to provide formal feedback at least 25 time(s) per quarter.,Performance Management
963,"What is the company policy on leave encashment for managerial employees in the leave policy framework, scenario #4290?",Employees may encash up to 6 unused leave days at year-end if approved by HR and Finance.,Leave Policy
964,"What is the company policy on emergency drill for probationary employees in the workplace & facilities framework, scenario #2917?",Employees must participate in at least 8 emergency drill(s) per year where scheduled.,Workplace & Facilities
965,"What is the company policy on conflict of interest for contract employees in our code of conduct framework, scenario #1162?",Potential conflicts of interest must be disclosed within 27 days of becoming known.,Code of Conduct
966,"What is the company policy on medical fitness for managerial employees in our recruitment framework, scenario #9718?",Roles requiring medical fitness clearance must complete the process within 11 days of offer acceptance.,Recruitment
967,"What is the company policy on data deletion for sales employees in the it & security framework, scenario #582?",Data deletion requests involving employee records must follow approved retention schedules and authorization steps.,IT & Security
968,"What is the company policy on meal benefit for support employees in the benefits framework, scenario #6893?",Eligible employees receive meal benefit support of up to ₹15000 per month.,Benefits
969,"What is the company policy on password reset for full-time employees in our it & security framework, scenario #3734?",Passwords must be changed at least once every 13 days or earlier if compromise is suspected.,IT & Security
970,"What is the company policy on joining extension for engineering employees in the recruitment framework, scenario #5968?",Joining date extensions up to 13 days may be approved by Talent Acquisition and the hiring manager.,Recruitment
971,"What is the company policy on document submission for full-time employees in the recruitment framework, scenario #1634?",New hires must submit all joining documents within 7 working days of the start date.,Recruitment
972,"What is the company policy on late coming for full-time employees in the attendance framework, scenario #5164?",Employees arriving more than 15 minutes late on 9 occasions in a month may receive attendance counseling.,Attendance
973,"What is the company policy on parental insurance for contract employees in our benefits framework, scenario #1819?",Parents may be added to insurance by paying the applicable premium during the enrollment window in February.,Benefits
974,"What is the company policy on performance improvement for sales employees in our performance management framework, scenario #9748?",A performance improvement plan usually runs for 28 days with defined review checkpoints.,Performance Management
975,"What is the company policy on password reset for full-time employees in the it & security framework, scenario #4546?",Passwords must be changed at least once every 30 days or earlier if compromise is suspected.,IT & Security
976,"What is the company policy on rating appeal for sales employees in the performance management framework, scenario #6125?",Rating appeal requests must be submitted within 2 working days of receiving the appraisal outcome.,Performance Management
977,"What is the company policy on knowledge transfer for support employees in our separation framework, scenario #7197?",Knowledge transfer plan must be completed at least 11 working days before exit for critical roles.,Separation
978,"What is the company policy on dress code for sales employees in our code of conduct framework, scenario #6177?",Employees are expected to follow formal dress standards on regular office days.,Code of Conduct
979,"What is the company policy on location approval for engineering employees in our remote work framework, scenario #8803?",Employees must obtain approval before working remotely from a location outside their registered city for more than 11 days.,Remote Work
980,"What is the company policy on accident cover for contract employees in the benefits framework, scenario #5836?",Accident insurance cover of ₹2000 is provided for employees on company rolls.,Benefits
981,"What is the company policy on salary payment for sales employees in our compensation framework, scenario #5481?",Monthly salary is credited on the 21st working day of each month.,Compensation
982,"What is the company policy on substance policy for managerial employees in the code of conduct framework, scenario #139?",Reporting to work under the influence of prohibited substances may lead to disciplinary action.,Code of Conduct
983,"What is the company policy on canteen subsidy for contract employees in the workplace & facilities framework, scenario #9024?",Eligible employees receive canteen subsidy of ₹15000 per working day.,Workplace & Facilities
984,"What is the company policy on casual leave for contract employees in the leave policy framework, scenario #1837?",Casual leave entitlement is 7 days per year and should normally be applied for at least 7 working day(s) in advance.,Leave Policy
985,"What is the company policy on incident reporting for probationary employees in the it & security framework, scenario #7844?",Suspected security incidents must be reported within 7 hour(s) of discovery.,IT & Security
986,"What is the company policy on data deletion for support employees in our it & security framework, scenario #2663?",Data deletion requests involving employee records must follow approved retention schedules and authorization steps.,IT & Security
987,"What is the company policy on annual leave for sales employees in the leave policy framework, scenario #8600?",Annual leave entitlement is 6 days per calendar year for sales employees.,Leave Policy
988,"What is the company policy on parking policy for intern employees in the workplace & facilities framework, scenario #2150?",Limited parking slots are allotted on a priority basis and may require monthly renewal by the 3rd.,Workplace & Facilities
989,"What is the company policy on remote travel for probationary employees in our remote work framework, scenario #3229?",Remote work while on personal travel is permitted for up to 16 working days per quarter with manager approval.,Remote Work
990,"What is the company policy on annual leave for managerial employees in our leave policy framework, scenario #1213?",Annual leave entitlement is 12 days per calendar year for managerial employees.,Leave Policy
991,"What is the company policy on dress code for intern employees in the code of conduct framework, scenario #3327?",Employees are expected to follow business casual dress standards on regular office days.,Code of Conduct
992,"What is the company policy on night shift for engineering employees in our attendance framework, scenario #5926?",Night shift is defined as work performed between 7:00 PM and 7:00 PM.,Attendance
993,"What is the company policy on paternity leave for full-time employees in our leave policy framework, scenario #2741?",Eligible employees may take 19 working days of paternity leave within 5 days of childbirth or adoption.,Leave Policy
994,"What is the company policy on social media for support employees in our code of conduct framework, scenario #2479?",Employees must not disclose confidential company information on social media at any time.,Code of Conduct
995,"What is the company policy on attendance correction for managerial employees in the attendance framework, scenario #2196?",Attendance correction requests must be submitted within 28 calendar days of the missed punch.,Attendance
996,"What is the company policy on access card for full-time employees in our workplace & facilities framework, scenario #6647?",Lost access cards must be reported within 15 hour(s) and replacement charges may apply.,Workplace & Facilities
997,"What is the company policy on bereavement leave for support employees in our leave policy framework, scenario #4438?",Employees may take 24 working days of bereavement leave for immediate family members.,Leave Policy
998,"What is the company policy on rehire policy for probationary employees in our recruitment framework, scenario #5020?","Former employees may be considered for rehire after a cooling period of 30 months, subject to records review.",Recruitment
999,"What is the company policy on vpn usage for contract employees in our it & security framework, scenario #2240?",Remote access to internal systems must use the company VPN for all sessions involving restricted data.,IT & Security
1000,"What is the company policy on expense reimbursement for contract employees in our compensation framework, scenario #3498?",Approved expense claims must be submitted within 25 days of the expense date.,Compensation
1001,"What is the company policy on desk allocation for managerial employees in the workplace & facilities framework, scenario #6036?",Desk allocation is managed by Facilities and may change based on seating plans and team movement.,Workplace & Facilities
1002,"What is the company policy on ergonomic support for engineering employees in the workplace & facilities framework, scenario #1843?",Employees may request ergonomic equipment through Facilities subject to role need and stock.,Workplace & Facilities
1003,"What is the company policy on social media for support employees in our code of conduct framework, scenario #3086?",Employees must not disclose confidential company information on social media at any time.,Code of Conduct
1004,"What is the company policy on travel allowance for full-time employees in our compensation framework, scenario #2920?",Domestic business travel provides a daily allowance of ₹5000 for meals and local transport.,Compensation
1005,"What is the company policy on canteen subsidy for managerial employees in our workplace & facilities framework, scenario #2695?",Eligible employees receive canteen subsidy of ₹2000 per working day.,Workplace & Facilities
1006,"What is the company policy on maternity leave for engineering employees in our leave policy framework, scenario #5772?",Eligible employees may take 4 weeks of maternity leave in line with company policy and applicable law.,Leave Policy
1007,"What is the company policy on asset return for contract employees in our separation framework, scenario #3695?",All company assets must be returned by the last working day or within 30 days if specifically approved.,Separation
1008,"What is the company policy on remote availability for engineering employees in the remote work framework, scenario #8285?",Employees working remotely must be reachable between 8:00 AM and 6:00 AM on official communication channels.,Remote Work
1009,"What is the company policy on remote availability for managerial employees in our remote work framework, scenario #8752?",Employees working remotely must be reachable between 8:30 AM and 5:30 PM on official communication channels.,Remote Work
1010,"What is the company policy on education support for sales employees in our benefits framework, scenario #2523?",Job-related certification reimbursement is capped at ₹10000 per year after manager approval.,Benefits
1011,"What is the company policy on reward nomination for contract employees in the performance management framework, scenario #7845?",Spot award nominations should be submitted within 22 days of the recognized contribution.,Performance Management
1012,"What is the company policy on salary revision for full-time employees in our compensation framework, scenario #2000?",Salary revisions are normally effective from September based on performance and business conditions.,Compensation
