id,question,answer,category
1464,"What is the company policy on meal benefit for engineering employees in the benefits framework, scenario #9269?",Eligible employees receive meal benefit support of up to ₹25000 per month.,Benefits
1465,"What is the company policy on expense reimbursement for probationary employees in the compensation framework, scenario #5003?",Approved expense claims must be submitted within 24 days of the expense date.,Compensation
1466,"What is the company policy on knowledge transfer for full-time employees in the separation framework, scenario #5467?",Knowledge transfer plan must be completed at least 6 working days before exit for critical roles.,Separation
1467,"What is the company policy on travel allowance for support employees in our compensation framework, scenario #671?",Domestic business travel provides a daily allowance of ₹15000 for meals and local transport.,Compensation
1468,"What is the company policy on visa expense for contract employees in our travel policy framework, scenario #6698?",Visa-related expenses for approved international travel are reimbursable through the standard expense process.,Travel Policy
1469,"What is the company policy on gifts policy for full-time employees in the code of conduct framework, scenario #1464?",Employees may not accept gifts above ₹15000 without written approval.,Code of Conduct
1470,"What is the company policy on device security for engineering employees in our remote work framework, scenario #5627?",Company laptops used remotely must be locked after 6 minutes of inactivity and protected with approved security software.,Remote Work
1471,"What is the company policy on biometric use for probationary employees in our attendance framework, scenario #3376?",Biometric attendance is mandatory for all on-site employees except those specifically exempted by HR for up to 23 days.,Attendance
1472,"What is the company policy on buyout policy for intern employees in the separation framework, scenario #5926?",Notice buyout may be allowed for up to 14 days subject to management approval.,Separation
1473,"What is the company policy on promotion review for intern employees in the performance management framework, scenario #9540?","Promotion nominations are reviewed in November based on performance, readiness, and budget.",Performance Management
1474,"What is the company policy on employee assistance for intern employees in the benefits framework, scenario #5457?",The employee assistance program provides up to 28 confidential counseling sessions per year.,Benefits
1475,"What is the company policy on full and final settlement for sales employees in our separation framework, scenario #4171?",Full and final settlement is generally processed within 15 days after separation documentation is complete.,Separation
1476,"What is the company policy on core hours for probationary employees in our attendance framework, scenario #5727?",Employees on flexible schedules must be available during core hours from 7:00 PM to 7:00 PM.,Attendance
1477,"What is the company policy on password reset for sales employees in the it & security framework, scenario #6727?",Passwords must be changed at least once every 27 days or earlier if compromise is suspected.,IT & Security
1478,"What is the company policy on remote availability for full-time employees in our remote work framework, scenario #4024?",Employees working remotely must be reachable between 10:00 AM and 4:30 PM on official communication channels.,Remote Work
1479,"What is the company policy on parental insurance for engineering employees in the benefits framework, scenario #317?",Parents may be added to insurance by paying the applicable premium during the enrollment window in October.,Benefits
1480,"What is the company policy on weekend work for full-time employees in the attendance framework, scenario #8668?",Weekend work requires prior approval from the reporting manager and must be logged within 12 hours.,Attendance
1481,"What is the company policy on probation review for contract employees in our performance management framework, scenario #3935?",Probation confirmation review takes place around the 22nd month of employment.,Performance Management
1482,"What is the company policy on probation review for managerial employees in the performance management framework, scenario #120?",Probation confirmation review takes place around the 23rd month of employment.,Performance Management
1483,"What is the company policy on timesheet for contract employees in our attendance framework, scenario #1025?",Timesheets must be submitted by Tuesday each week before 4:00 PM.,Attendance
1484,"What is the company policy on access card for full-time employees in our workplace & facilities framework, scenario #2974?",Lost access cards must be reported within 17 hour(s) and replacement charges may apply.,Workplace & Facilities
1485,"What is the company policy on garden leave for sales employees in the separation framework, scenario #1238?",Garden leave may be applied during notice period based on business sensitivity and approval.,Separation
1486,"What is the company policy on accident cover for probationary employees in our benefits framework, scenario #6100?",Accident insurance cover of ₹20000 is provided for employees on company rolls.,Benefits
1487,"What is the company policy on visitor policy for sales employees in our workplace & facilities framework, scenario #2366?",Visitors must be registered at reception and hosted by an employee at all times.,Workplace & Facilities
1488,"What is the company policy on maternity leave for intern employees in the leave policy framework, scenario #458?",Eligible employees may take 18 weeks of maternity leave in line with company policy and applicable law.,Leave Policy
1489,"What is the company policy on timesheet for intern employees in the attendance framework, scenario #8326?",Timesheets must be submitted by Monday each week before 9:30 AM.,Attendance
1490,"What is the company policy on respectful behavior for full-time employees in the code of conduct framework, scenario #7917?","Abusive or threatening conduct toward colleagues, customers, or vendors is prohibited.",Code of Conduct
1491,"What is the company policy on candidate travel for probationary employees in the recruitment framework, scenario #733?",Interview travel reimbursement must be claimed within 23 days of the interview date.,Recruitment
1492,"What is the company policy on bonus payout for sales employees in our compensation framework, scenario #4099?","Annual performance bonus, where applicable, is paid in July after review completion.",Compensation
1493,"What is the company policy on domestic travel for full-time employees in the travel policy framework, scenario #6507?",Domestic travel should normally be booked at least 19 days in advance unless there is a business emergency.,Travel Policy
1494,"What is the company policy on data classification for managerial employees in the it & security framework, scenario #6579?",Documents classified as Internal may only be shared with authorized recipients.,IT & Security
1495,"What is the company policy on casual leave for full-time employees in the leave policy framework, scenario #1355?",Casual leave entitlement is 6 days per year and should normally be applied for at least 2 working day(s) in advance.,Leave Policy
1496,"What is the company policy on carry forward for probationary employees in our leave policy framework, scenario #772?","Up to 12 unused annual leave days may be carried forward, subject to manager approval by June.",Leave Policy
1497,"What is the company policy on short breaks for probationary employees in the attendance framework, scenario #7962?","Employees may take up to 30 short breaks per day, each not exceeding 9 minutes.",Attendance
1498,"What is the company policy on desk allocation for managerial employees in our workplace & facilities framework, scenario #3422?",Desk allocation is managed by Facilities and may change based on seating plans and team movement.,Workplace & Facilities
1499,"What is the company policy on travel allowance for managerial employees in the compensation framework, scenario #1312?",Domestic business travel provides a daily allowance of ₹5000 for meals and local transport.,Compensation
1500,"What is the company policy on rehire restriction for intern employees in our separation framework, scenario #8739?",Employees separated for misconduct may not be eligible for rehire under company policy.,Separation
1501,"What is the company policy on unpaid leave for intern employees in our leave policy framework, scenario #7821?",Unpaid leave beyond regular entitlement may be granted for up to 10 working days with management approval.,Leave Policy
1502,"What is the company policy on background check for managerial employees in the recruitment framework, scenario #2727?",Employment is subject to satisfactory background verification completed within approximately 4 weeks.,Recruitment
1503,"What is the company policy on medical fitness for sales employees in our recruitment framework, scenario #6209?",Roles requiring medical fitness clearance must complete the process within 7 days of offer acceptance.,Recruitment
1504,"What is the company policy on clean desk for support employees in our workplace & facilities framework, scenario #7675?",Employees must clear sensitive papers from desks before leaving for the day.,Workplace & Facilities
1505,"What is the company policy on maternity leave for support employees in our leave policy framework, scenario #2019?",Eligible employees may take 19 weeks of maternity leave in line with company policy and applicable law.,Leave Policy
1506,"What is the company policy on camera policy for full-time employees in the remote work framework, scenario #4133?",Video must be enabled during designated collaboration meetings unless connectivity is unstable for more than 20 minutes.,Remote Work
1507,"What is the company policy on education support for sales employees in the benefits framework, scenario #9811?",Job-related certification reimbursement is capped at ₹500 per year after manager approval.,Benefits
1508,"What is the company policy on parental insurance for managerial employees in the benefits framework, scenario #9481?",Parents may be added to insurance by paying the applicable premium during the enrollment window in April.,Benefits
1509,"What is the company policy on leave balance payout for engineering employees in our separation framework, scenario #490?",Eligible unused leave payout is calculated according to policy and applicable payroll rules.,Separation
1510,"What is the company policy on asset misuse for managerial employees in the code of conduct framework, scenario #1525?",Misuse of company property may result in recovery of costs and disciplinary action.,Code of Conduct
1511,"What is the company policy on per diem for contract employees in our travel policy framework, scenario #2846?",Per diem for approved travel to category-2 locations is ₹25000 per day.,Travel Policy
1512,"What is the company policy on international travel for sales employees in the travel policy framework, scenario #2930?",International travel requires approval from the function head at least 16 working days before departure.,Travel Policy
1513,"What is the company policy on software installation for full-time employees in our it & security framework, scenario #8681?","Only approved software may be installed, and requests should be raised through IT at least 10 day(s) in advance.",IT & Security
1514,"What is the company policy on whistleblower for sales employees in our code of conduct framework, scenario #4519?",Whistleblower complaints may be made confidentially through the approved reporting channels.,Code of Conduct
1515,"What is the company policy on remote eligibility for managerial employees in the remote work framework, scenario #9100?",managerial employees may work remotely up to 8 days per week subject to role suitability.,Remote Work
1516,"What is the company policy on overtime pay for full-time employees in the compensation framework, scenario #7542?",Eligible employees receive overtime at 2.0x the hourly rate for approved extra hours.,Compensation
1517,"What is the company policy on sick leave for support employees in our leave policy framework, scenario #2070?","Sick leave entitlement is 12 days per year, and medical proof is required after 1 consecutive days of absence.",Leave Policy
1518,"What is the company policy on joining bonus for sales employees in our compensation framework, scenario #3458?",Joining bonus recovery applies if the employee leaves within 23 months of joining.,Compensation
1519,"What is the company policy on travel insurance for managerial employees in the travel policy framework, scenario #6316?",Travel insurance is mandatory for all approved international business trips.,Travel Policy
1520,"What is the company policy on location approval for intern employees in the remote work framework, scenario #4226?",Employees must obtain approval before working remotely from a location outside their registered city for more than 20 days.,Remote Work
1521,"What is the company policy on wellness benefit for engineering employees in the benefits framework, scenario #8496?",Employees may claim wellness reimbursement of up to ₹2500 per year for approved activities.,Benefits
1522,"What is the company policy on resignation notice for sales employees in the separation framework, scenario #9854?",Notice period for sales employees is 27 days unless the contract states otherwise.,Separation
1523,"What is the company policy on night shift for managerial employees in the attendance framework, scenario #3618?",Night shift is defined as work performed between 7:00 PM and 5:30 PM.,Attendance
1524,"What is the company policy on medical fitness for sales employees in our recruitment framework, scenario #5092?",Roles requiring medical fitness clearance must complete the process within 8 days of offer acceptance.,Recruitment
1525,"What is the company policy on timesheet for full-time employees in the attendance framework, scenario #9425?",Timesheets must be submitted by Wednesday each week before 10:00 AM.,Attendance
1526,"What is the company policy on usb policy for support employees in our it & security framework, scenario #3872?",Use of personal USB devices on company systems is prohibited unless approved for up to 27 days.,IT & Security
1527,"What is the company policy on intern conversion for full-time employees in our recruitment framework, scenario #4087?",Intern-to-full-time conversion is evaluated during the final 1 weeks of internship.,Recruitment
1528,"What is the company policy on meeting room for sales employees in the workplace & facilities framework, scenario #3219?",Meeting rooms should be released if unused for more than 11 minutes after booking time.,Workplace & Facilities
1529,"What is the company policy on wellness benefit for full-time employees in our benefits framework, scenario #7483?",Employees may claim wellness reimbursement of up to ₹20000 per year for approved activities.,Benefits
1530,"What is the company policy on joining bonus for intern employees in the compensation framework, scenario #2929?",Joining bonus recovery applies if the employee leaves within 27 months of joining.,Compensation
1531,"What is the company policy on remote check-in for engineering employees in the remote work framework, scenario #4073?",Remote employees must attend a team check-in at 10:30 AM on every Monday.,Remote Work
1532,"What is the company policy on location approval for probationary employees in our remote work framework, scenario #5586?",Employees must obtain approval before working remotely from a location outside their registered city for more than 4 days.,Remote Work
1533,"What is the company policy on joining extension for engineering employees in our recruitment framework, scenario #350?",Joining date extensions up to 3 days may be approved by Talent Acquisition and the hiring manager.,Recruitment
1534,"What is the company policy on performance improvement for sales employees in the performance management framework, scenario #8437?",A performance improvement plan usually runs for 24 days with defined review checkpoints.,Performance Management
1535,"What is the company policy on exit interview for support employees in our separation framework, scenario #7141?",Employees are expected to complete the exit interview within 9 working days before their last working day.,Separation
1536,"What is the company policy on shift allowance for engineering employees in the attendance framework, scenario #8277?",Employees assigned to the rotational shift receive a shift allowance of ₹1500 per shift.,Attendance
1537,"What is the company policy on unpaid leave for sales employees in the leave policy framework, scenario #6323?",Unpaid leave beyond regular entitlement may be granted for up to 2 working days with management approval.,Leave Policy
1538,"What is the company policy on phone reimbursement for managerial employees in our compensation framework, scenario #6558?",Eligible roles may claim mobile reimbursement up to ₹25000 per month.,Compensation
1539,"What is the company policy on mfa requirement for contract employees in our it & security framework, scenario #2529?",Multi-factor authentication is mandatory for access to all critical systems.,IT & Security
1540,"What is the company policy on asset return for sales employees in the separation framework, scenario #4183?",All company assets must be returned by the last working day or within 15 days if specifically approved.,Separation
1541,"What is the company policy on promotion review for managerial employees in our performance management framework, scenario #8052?","Promotion nominations are reviewed in July based on performance, readiness, and budget.",Performance Management
1542,"What is the company policy on late coming for full-time employees in the attendance framework, scenario #9644?",Employees arriving more than 14 minutes late on 5 occasions in a month may receive attendance counseling.,Attendance
1543,"What is the company policy on remote eligibility for engineering employees in our remote work framework, scenario #8113?",engineering employees may work remotely up to 24 days per week subject to role suitability.,Remote Work
1544,"What is the company policy on ergonomic support for probationary employees in our workplace & facilities framework, scenario #4753?",Employees may request ergonomic equipment through Facilities subject to role need and stock.,Workplace & Facilities
1545,"What is the company policy on probation review for sales employees in the performance management framework, scenario #5077?",Probation confirmation review takes place around the 1st month of employment.,Performance Management
1546,"What is the company policy on background check for sales employees in the recruitment framework, scenario #291?",Employment is subject to satisfactory background verification completed within approximately 13 weeks.,Recruitment
1547,"What is the company policy on dress code for sales employees in the code of conduct framework, scenario #7412?",Employees are expected to follow business casual dress standards on regular office days.,Code of Conduct
1548,"What is the company policy on manager feedback for intern employees in our performance management framework, scenario #1292?",Managers are expected to provide formal feedback at least 2 time(s) per quarter.,Performance Management
1549,"What is the company policy on experience letter for probationary employees in our separation framework, scenario #8638?",Experience and relieving letters are issued after clearance completion and payroll closure.,Separation
1550,"What is the company policy on email retention for full-time employees in our it & security framework, scenario #2545?",Official email records are retained for approximately 25 months in line with policy.,IT & Security
1551,"What is the company policy on casual leave for sales employees in the leave policy framework, scenario #1208?",Casual leave entitlement is 6 days per year and should normally be applied for at least 5 working day(s) in advance.,Leave Policy
1552,"What is the company policy on attendance correction for support employees in the attendance framework, scenario #8215?",Attendance correction requests must be submitted within 2 calendar days of the missed punch.,Attendance
1553,"What is the company policy on international travel for engineering employees in our travel policy framework, scenario #1528?",International travel requires approval from the function head at least 27 working days before departure.,Travel Policy
1554,"What is the company policy on salary revision for probationary employees in our compensation framework, scenario #5109?",Salary revisions are normally effective from September based on performance and business conditions.,Compensation
1555,"What is the company policy on harassment reporting for sales employees in our code of conduct framework, scenario #6386?",Workplace harassment concerns should be reported within 17 days to HR or the designated committee.,Code of Conduct
1556,"What is the company policy on meal benefit for engineering employees in the benefits framework, scenario #9901?",Eligible employees receive meal benefit support of up to ₹1500 per month.,Benefits
1557,"What is the company policy on joining bonus for sales employees in our compensation framework, scenario #5745?",Joining bonus recovery applies if the employee leaves within 20 months of joining.,Compensation
1558,"What is the company policy on salary revision for engineering employees in our compensation framework, scenario #1551?",Salary revisions are normally effective from January based on performance and business conditions.,Compensation
1559,"What is the company policy on location approval for sales employees in our remote work framework, scenario #8467?",Employees must obtain approval before working remotely from a location outside their registered city for more than 8 days.,Remote Work
1560,"What is the company policy on weekend work for probationary employees in our attendance framework, scenario #9757?",Weekend work requires prior approval from the reporting manager and must be logged within 1 hours.,Attendance
1561,"What is the company policy on joining bonus for probationary employees in our compensation framework, scenario #4813?",Joining bonus recovery applies if the employee leaves within 27 months of joining.,Compensation
1562,"What is the company policy on shift allowance for sales employees in our attendance framework, scenario #435?",Employees assigned to the rotational shift receive a shift allowance of ₹25000 per shift.,Attendance
1563,"What is the company policy on joining bonus for sales employees in our compensation framework, scenario #3857?",Joining bonus recovery applies if the employee leaves within 12 months of joining.,Compensation
1564,"What is the company policy on weekend work for contract employees in our attendance framework, scenario #9068?",Weekend work requires prior approval from the reporting manager and must be logged within 7 hours.,Attendance
1565,"What is the company policy on conflict of interest for sales employees in our code of conduct framework, scenario #3752?",Potential conflicts of interest must be disclosed within 9 days of becoming known.,Code of Conduct
1566,"What is the company policy on training link for probationary employees in our performance management framework, scenario #256?",Completion of mandatory learning may influence performance compliance if overdue by more than 20 days.,Performance Management
1567,"What is the company policy on timesheet for managerial employees in our attendance framework, scenario #9556?",Timesheets must be submitted by Tuesday each week before 11:00 AM.,Attendance
1568,"What is the company policy on location approval for full-time employees in the remote work framework, scenario #6804?",Employees must obtain approval before working remotely from a location outside their registered city for more than 11 days.,Remote Work
1569,"What is the company policy on biometric use for sales employees in the attendance framework, scenario #9187?",Biometric attendance is mandatory for all on-site employees except those specifically exempted by HR for up to 15 days.,Attendance
1570,"What is the company policy on candidate travel for full-time employees in the recruitment framework, scenario #9928?",Interview travel reimbursement must be claimed within 5 days of the interview date.,Recruitment
1571,"What is the company policy on internet reimbursement for contract employees in the remote work framework, scenario #2549?",Remote employees may claim internet reimbursement of up to ₹500000 per month.,Remote Work
1572,"What is the company policy on overtime pay for intern employees in the compensation framework, scenario #9461?",Eligible employees receive overtime at 2.0x the hourly rate for approved extra hours.,Compensation
1573,"What is the company policy on buyout policy for contract employees in our separation framework, scenario #9913?",Notice buyout may be allowed for up to 23 days subject to management approval.,Separation
1574,"What is the company policy on travel advance for contract employees in the travel policy framework, scenario #1903?",Travel advance requests must be raised at least 11 working days before the trip.,Travel Policy
1575,"What is the company policy on timesheet for support employees in the attendance framework, scenario #6368?",Timesheets must be submitted by Friday each week before 9:00 AM.,Attendance
