id,question,answer,category
452,"What is the company policy on travel insurance for probationary employees in our travel policy framework, scenario #7003?",Travel insurance is mandatory for all approved international business trips.,Travel Policy
453,"What is the company policy on timesheet for contract employees in our attendance framework, scenario #3207?",Timesheets must be submitted by Wednesday each week before 5:00 PM.,Attendance
454,"What is the company policy on remote availability for engineering employees in our remote work framework, scenario #9267?",Employees working remotely must be reachable between 8:00 PM and 5:00 AM on official communication channels.,Remote Work
455,"What is the company policy on remote availability for engineering employees in the remote work framework, scenario #4282?",Employees working remotely must be reachable between 8:00 PM and 7:00 PM on official communication channels.,Remote Work
456,"What is the company policy on travel insurance for contract employees in our travel policy framework, scenario #9603?",Travel insurance is mandatory for all approved international business trips.,Travel Policy
457,"What is the company policy on education support for engineering employees in our benefits framework, scenario #8601?",Job-related certification reimbursement is capped at ₹1000 per year after manager approval.,Benefits
458,"What is the company policy on joining extension for engineering employees in the recruitment framework, scenario #3144?",Joining date extensions up to 24 days may be approved by Talent Acquisition and the hiring manager.,Recruitment
459,"What is the company policy on education support for contract employees in our benefits framework, scenario #1652?",Job-related certification reimbursement is capped at ₹1200 per year after manager approval.,Benefits
460,"What is the company policy on annual leave for intern employees in our leave policy framework, scenario #3926?",Annual leave entitlement is 9 days per calendar year for intern employees.,Leave Policy
461,"What is the company policy on manager feedback for engineering employees in our performance management framework, scenario #7786?",Managers are expected to provide formal feedback at least 13 time(s) per quarter.,Performance Management
462,"What is the company policy on incident reporting for engineering employees in the it & security framework, scenario #6306?",Suspected security incidents must be reported within 22 hour(s) of discovery.,IT & Security
463,"What is the company policy on employee assistance for full-time employees in the benefits framework, scenario #3468?",The employee assistance program provides up to 7 confidential counseling sessions per year.,Benefits
464,"What is the company policy on home office for engineering employees in the remote work framework, scenario #9437?",The company reimburses up to ₹500 once every 4 months for approved home-office items.,Remote Work
465,"What is the company policy on international travel for support employees in the travel policy framework, scenario #9386?",International travel requires approval from the function head at least 21 working days before departure.,Travel Policy
466,"What is the company policy on rating appeal for full-time employees in the performance management framework, scenario #6477?",Rating appeal requests must be submitted within 28 working days of receiving the appraisal outcome.,Performance Management
467,"What is the company policy on comp-off for sales employees in the leave policy framework, scenario #4481?",Compensatory off earned for approved extra work must be used within 28 days of accrual.,Leave Policy
468,"What is the company policy on clean desk for sales employees in the workplace & facilities framework, scenario #354?",Employees must clear sensitive papers from desks before leaving for the day.,Workplace & Facilities
469,"What is the company policy on incident reporting for support employees in our it & security framework, scenario #7497?",Suspected security incidents must be reported within 11 hour(s) of discovery.,IT & Security
470,"What is the company policy on exit interview for managerial employees in our separation framework, scenario #2757?",Employees are expected to complete the exit interview within 19 working days before their last working day.,Separation
471,"What is the company policy on sick leave for probationary employees in our leave policy framework, scenario #1469?","Sick leave entitlement is 12 days per year, and medical proof is required after 8 consecutive days of absence.",Leave Policy
472,"What is the company policy on respectful behavior for full-time employees in the code of conduct framework, scenario #6291?","Abusive or threatening conduct toward colleagues, customers, or vendors is prohibited.",Code of Conduct
473,"What is the company policy on respectful behavior for engineering employees in the code of conduct framework, scenario #9816?","Abusive or threatening conduct toward colleagues, customers, or vendors is prohibited.",Code of Conduct
474,"What is the company policy on canteen subsidy for probationary employees in our workplace & facilities framework, scenario #8920?",Eligible employees receive canteen subsidy of ₹50000 per working day.,Workplace & Facilities
475,"What is the company policy on device security for full-time employees in the remote work framework, scenario #602?",Company laptops used remotely must be locked after 22 minutes of inactivity and protected with approved security software.,Remote Work
476,"What is the company policy on bonus payout for intern employees in our compensation framework, scenario #1365?","Annual performance bonus, where applicable, is paid in October after review completion.",Compensation
477,"What is the company policy on education support for probationary employees in the benefits framework, scenario #1271?",Job-related certification reimbursement is capped at ₹500000 per year after manager approval.,Benefits
478,"What is the company policy on parental insurance for probationary employees in our benefits framework, scenario #1721?",Parents may be added to insurance by paying the applicable premium during the enrollment window in July.,Benefits
479,"What is the company policy on short breaks for managerial employees in our attendance framework, scenario #8712?","Employees may take up to 17 short breaks per day, each not exceeding 12 minutes.",Attendance
480,"What is the company policy on data deletion for contract employees in the it & security framework, scenario #9973?",Data deletion requests involving employee records must follow approved retention schedules and authorization steps.,IT & Security
481,"What is the company policy on candidate travel for sales employees in the recruitment framework, scenario #3933?",Interview travel reimbursement must be claimed within 6 days of the interview date.,Recruitment
482,"What is the company policy on short breaks for sales employees in the attendance framework, scenario #6963?","Employees may take up to 19 short breaks per day, each not exceeding 1 minutes.",Attendance
483,"What is the company policy on ergonomic support for full-time employees in our workplace & facilities framework, scenario #8119?",Employees may request ergonomic equipment through Facilities subject to role need and stock.,Workplace & Facilities
484,"What is the company policy on document submission for intern employees in our recruitment framework, scenario #8000?",New hires must submit all joining documents within 12 working days of the start date.,Recruitment
485,"What is the company policy on bereavement leave for sales employees in the leave policy framework, scenario #8669?",Employees may take 1 working days of bereavement leave for immediate family members.,Leave Policy
486,"What is the company policy on data classification for contract employees in our it & security framework, scenario #7199?",Documents classified as Confidential may only be shared with authorized recipients.,IT & Security
487,"What is the company policy on internet reimbursement for engineering employees in our remote work framework, scenario #4355?",Remote employees may claim internet reimbursement of up to ₹25000 per month.,Remote Work
488,"What is the company policy on night shift for contract employees in the attendance framework, scenario #853?",Night shift is defined as work performed between 6:00 PM and 5:00 AM.,Attendance
489,"What is the company policy on experience letter for managerial employees in our separation framework, scenario #4053?",Experience and relieving letters are issued after clearance completion and payroll closure.,Separation
490,"What is the company policy on garden leave for contract employees in the separation framework, scenario #1490?",Garden leave may be applied during notice period based on business sensitivity and approval.,Separation
491,"What is the company policy on carry forward for intern employees in our leave policy framework, scenario #6850?","Up to 14 unused annual leave days may be carried forward, subject to manager approval by December.",Leave Policy
492,"What is the company policy on expense reimbursement for full-time employees in our compensation framework, scenario #4987?",Approved expense claims must be submitted within 29 days of the expense date.,Compensation
493,"What is the company policy on late coming for engineering employees in the attendance framework, scenario #1743?",Employees arriving more than 22 minutes late on 1 occasions in a month may receive attendance counseling.,Attendance
494,"What is the company policy on coworking reimbursement for managerial employees in our remote work framework, scenario #9020?",The company reimburses up to ₹2500 per month for approved coworking space use in exceptional cases.,Remote Work
495,"What is the company policy on access card for managerial employees in the workplace & facilities framework, scenario #9277?",Lost access cards must be reported within 29 hour(s) and replacement charges may apply.,Workplace & Facilities
496,"What is the company policy on maternity leave for probationary employees in the leave policy framework, scenario #9370?",Eligible employees may take 24 weeks of maternity leave in line with company policy and applicable law.,Leave Policy
497,"What is the company policy on relocation support for sales employees in the compensation framework, scenario #2428?",Relocation assistance up to ₹300000 is available for approved transfers subject to bills within 23 days.,Compensation
498,"What is the company policy on accident cover for probationary employees in our benefits framework, scenario #5319?",Accident insurance cover of ₹3000 is provided for employees on company rolls.,Benefits
499,"What is the company policy on annual leave for sales employees in our leave policy framework, scenario #3342?",Annual leave entitlement is 27 days per calendar year for sales employees.,Leave Policy
500,"What is the company policy on visa expense for support employees in the travel policy framework, scenario #4622?",Visa-related expenses for approved international travel are reimbursable through the standard expense process.,Travel Policy
501,"What is the company policy on paternity leave for intern employees in our leave policy framework, scenario #6292?",Eligible employees may take 6 working days of paternity leave within 3 days of childbirth or adoption.,Leave Policy
502,"What is the company policy on sick leave for intern employees in the leave policy framework, scenario #7872?","Sick leave entitlement is 27 days per year, and medical proof is required after 1 consecutive days of absence.",Leave Policy
503,"What is the company policy on travel insurance for managerial employees in our travel policy framework, scenario #2324?",Travel insurance is mandatory for all approved international business trips.,Travel Policy
504,"What is the company policy on maternity leave for contract employees in the leave policy framework, scenario #5468?",Eligible employees may take 1 weeks of maternity leave in line with company policy and applicable law.,Leave Policy
505,"What is the company policy on shift allowance for contract employees in the attendance framework, scenario #4442?",Employees assigned to the rotational shift receive a shift allowance of ₹750 per shift.,Attendance
506,"What is the company policy on substance policy for contract employees in the code of conduct framework, scenario #5293?",Reporting to work under the influence of prohibited substances may lead to disciplinary action.,Code of Conduct
507,"What is the company policy on internet reimbursement for managerial employees in the remote work framework, scenario #6302?",Remote employees may claim internet reimbursement of up to ₹15000 per month.,Remote Work
508,"What is the company policy on biometric use for intern employees in our attendance framework, scenario #5913?",Biometric attendance is mandatory for all on-site employees except those specifically exempted by HR for up to 23 days.,Attendance
509,"What is the company policy on remote check-in for intern employees in the remote work framework, scenario #1737?",Remote employees must attend a team check-in at 9:30 AM on every Tuesday.,Remote Work
510,"What is the company policy on knowledge transfer for contract employees in our separation framework, scenario #7704?",Knowledge transfer plan must be completed at least 3 working days before exit for critical roles.,Separation
511,"What is the company policy on intern conversion for probationary employees in our recruitment framework, scenario #3725?",Intern-to-full-time conversion is evaluated during the final 15 weeks of internship.,Recruitment
512,"What is the company policy on document submission for contract employees in our recruitment framework, scenario #6638?",New hires must submit all joining documents within 9 working days of the start date.,Recruitment
513,"What is the company policy on document submission for sales employees in the recruitment framework, scenario #9784?",New hires must submit all joining documents within 2 working days of the start date.,Recruitment
514,"What is the company policy on paternity leave for full-time employees in our leave policy framework, scenario #4627?",Eligible employees may take 7 working days of paternity leave within 9 days of childbirth or adoption.,Leave Policy
515,"What is the company policy on probation length for engineering employees in our recruitment framework, scenario #2642?",Standard probation period is 7 months unless otherwise stated in the appointment letter.,Recruitment
516,"What is the company policy on remote travel for intern employees in the remote work framework, scenario #6351?",Remote work while on personal travel is permitted for up to 3 working days per quarter with manager approval.,Remote Work
517,"What is the company policy on joining bonus for managerial employees in the compensation framework, scenario #1117?",Joining bonus recovery applies if the employee leaves within 20 months of joining.,Compensation
518,"What is the company policy on employee assistance for contract employees in our benefits framework, scenario #6702?",The employee assistance program provides up to 12 confidential counseling sessions per year.,Benefits
519,"What is the company policy on hotel cap for engineering employees in the travel policy framework, scenario #9189?",Hotel reimbursement is capped at ₹300000 per night for travel to tier-3 cities.,Travel Policy
520,"What is the company policy on casual leave for contract employees in the leave policy framework, scenario #1407?",Casual leave entitlement is 28 days per year and should normally be applied for at least 2 working day(s) in advance.,Leave Policy
521,"What is the company policy on home office for support employees in our remote work framework, scenario #2385?",The company reimburses up to ₹25000 once every 30 months for approved home-office items.,Remote Work
522,"What is the company policy on asset return for support employees in the separation framework, scenario #2323?",All company assets must be returned by the last working day or within 11 days if specifically approved.,Separation
523,"What is the company policy on timesheet for managerial employees in our attendance framework, scenario #6867?",Timesheets must be submitted by Wednesday each week before 10:00 AM.,Attendance
524,"What is the company policy on investigation cooperation for support employees in the code of conduct framework, scenario #8183?",Employees are required to cooperate with internal investigations and provide information within 18 working days when requested.,Code of Conduct
525,"What is the company policy on goal setting for full-time employees in our performance management framework, scenario #3542?",Employees must finalize annual goals within 26 days of the performance cycle start.,Performance Management
526,"What is the company policy on performance improvement for engineering employees in our performance management framework, scenario #1858?",A performance improvement plan usually runs for 7 days with defined review checkpoints.,Performance Management
527,"What is the company policy on remote travel for contract employees in the remote work framework, scenario #8134?",Remote work while on personal travel is permitted for up to 14 working days per quarter with manager approval.,Remote Work
528,"What is the company policy on clean desk for managerial employees in our workplace & facilities framework, scenario #6766?",Employees must clear sensitive papers from desks before leaving for the day.,Workplace & Facilities
529,"What is the company policy on garden leave for sales employees in our separation framework, scenario #5491?",Garden leave may be applied during notice period based on business sensitivity and approval.,Separation
530,"What is the company policy on coworking reimbursement for intern employees in the remote work framework, scenario #1632?",The company reimburses up to ₹500000 per month for approved coworking space use in exceptional cases.,Remote Work
531,"What is the company policy on canteen subsidy for sales employees in our workplace & facilities framework, scenario #415?",Eligible employees receive canteen subsidy of ₹20000 per working day.,Workplace & Facilities
532,"What is the company policy on canteen subsidy for intern employees in the workplace & facilities framework, scenario #9493?",Eligible employees receive canteen subsidy of ₹15000 per working day.,Workplace & Facilities
533,"What is the company policy on late coming for contract employees in our attendance framework, scenario #1206?",Employees arriving more than 15 minutes late on 10 occasions in a month may receive attendance counseling.,Attendance
534,"What is the company policy on conflict of interest for engineering employees in the code of conduct framework, scenario #8549?",Potential conflicts of interest must be disclosed within 7 days of becoming known.,Code of Conduct
535,"What is the company policy on access card for full-time employees in our workplace & facilities framework, scenario #4484?",Lost access cards must be reported within 30 hour(s) and replacement charges may apply.,Workplace & Facilities
536,"What is the company policy on social media for sales employees in our code of conduct framework, scenario #1686?",Employees must not disclose confidential company information on social media at any time.,Code of Conduct
537,"What is the company policy on travel advance for managerial employees in our travel policy framework, scenario #1053?",Travel advance requests must be raised at least 10 working days before the trip.,Travel Policy
538,"What is the company policy on gifts policy for support employees in the code of conduct framework, scenario #6090?",Employees may not accept gifts above ₹300000 without written approval.,Code of Conduct
539,"What is the company policy on rating appeal for engineering employees in the performance management framework, scenario #9191?",Rating appeal requests must be submitted within 25 working days of receiving the appraisal outcome.,Performance Management
540,"What is the company policy on employee assistance for support employees in the benefits framework, scenario #7419?",The employee assistance program provides up to 29 confidential counseling sessions per year.,Benefits
541,"What is the company policy on coworking reimbursement for full-time employees in our remote work framework, scenario #267?",The company reimburses up to ₹20000 per month for approved coworking space use in exceptional cases.,Remote Work
542,"What is the company policy on weekend work for engineering employees in the attendance framework, scenario #6127?",Weekend work requires prior approval from the reporting manager and must be logged within 4 hours.,Attendance
543,"What is the company policy on international travel for contract employees in our travel policy framework, scenario #706?",International travel requires approval from the function head at least 1 working days before departure.,Travel Policy
544,"What is the company policy on working hours for support employees in the attendance framework, scenario #8549?",Standard working hours are 10:00 AM to 5:30 PM with a 30-minute meal break.,Attendance
545,"What is the company policy on usb policy for engineering employees in the it & security framework, scenario #1232?",Use of personal USB devices on company systems is prohibited unless approved for up to 19 days.,IT & Security
546,"What is the company policy on harassment reporting for support employees in the code of conduct framework, scenario #3585?",Workplace harassment concerns should be reported within 7 days to HR or the designated committee.,Code of Conduct
547,"What is the company policy on manager feedback for support employees in the performance management framework, scenario #272?",Managers are expected to provide formal feedback at least 15 time(s) per quarter.,Performance Management
548,"What is the company policy on gifts policy for managerial employees in our code of conduct framework, scenario #871?",Employees may not accept gifts above ₹100000 without written approval.,Code of Conduct
549,"What is the company policy on dress code for support employees in the code of conduct framework, scenario #4079?",Employees are expected to follow formal dress standards on regular office days.,Code of Conduct
550,"What is the company policy on core hours for sales employees in our attendance framework, scenario #3371?",Employees on flexible schedules must be available during core hours from 9:30 AM to 5:00 PM.,Attendance
551,"What is the company policy on remote availability for sales employees in the remote work framework, scenario #5443?",Employees working remotely must be reachable between 8:00 AM and 5:00 PM on official communication channels.,Remote Work
552,"What is the company policy on gifts policy for engineering employees in the code of conduct framework, scenario #741?",Employees may not accept gifts above ₹100000 without written approval.,Code of Conduct
553,"What is the company policy on unpaid leave for contract employees in our leave policy framework, scenario #5969?",Unpaid leave beyond regular entitlement may be granted for up to 22 working days with management approval.,Leave Policy
554,"What is the company policy on harassment reporting for engineering employees in the code of conduct framework, scenario #9464?",Workplace harassment concerns should be reported within 27 days to HR or the designated committee.,Code of Conduct
555,"What is the company policy on office timing for support employees in our workplace & facilities framework, scenario #5068?",Office facilities are generally accessible from 8:30 AM to 6:30 PM on business days.,Workplace & Facilities
556,"What is the company policy on salary payment for probationary employees in our compensation framework, scenario #9145?",Monthly salary is credited on the 19th working day of each month.,Compensation
557,"What is the company policy on exit interview for sales employees in the separation framework, scenario #818?",Employees are expected to complete the exit interview within 10 working days before their last working day.,Separation
558,"What is the company policy on accident cover for contract employees in our benefits framework, scenario #6924?",Accident insurance cover of ₹300000 is provided for employees on company rolls.,Benefits
559,"What is the company policy on background check for sales employees in our recruitment framework, scenario #1403?",Employment is subject to satisfactory background verification completed within approximately 29 weeks.,Recruitment
560,"What is the company policy on employee assistance for contract employees in our benefits framework, scenario #6890?",The employee assistance program provides up to 30 confidential counseling sessions per year.,Benefits
561,"What is the company policy on candidate travel for probationary employees in our recruitment framework, scenario #98?",Interview travel reimbursement must be claimed within 1 days of the interview date.,Recruitment
562,"What is the company policy on asset misuse for sales employees in the code of conduct framework, scenario #8459?",Misuse of company property may result in recovery of costs and disciplinary action.,Code of Conduct
563,"What is the company policy on camera policy for contract employees in the remote work framework, scenario #4051?",Video must be enabled during designated collaboration meetings unless connectivity is unstable for more than 24 minutes.,Remote Work
564,"What is the company policy on salary revision for support employees in the compensation framework, scenario #7084?",Salary revisions are normally effective from August based on performance and business conditions.,Compensation
