id,question,answer,category
1,"What is the company policy on buyout policy for intern employees in the separation framework, scenario #8929?",Notice buyout may be allowed for up to 1 days subject to management approval.,Separation
2,"What is the company policy on offer validity for contract employees in our recruitment framework, scenario #712?",An employment offer is normally valid for 15 calendar days from the issue date.,Recruitment
3,"What is the company policy on emergency drill for sales employees in our workplace & facilities framework, scenario #5978?",Employees must participate in at least 18 emergency drill(s) per year where scheduled.,Workplace & Facilities
4,"What is the company policy on location approval for probationary employees in our remote work framework, scenario #6573?",Employees must obtain approval before working remotely from a location outside their registered city for more than 12 days.,Remote Work
5,"What is the company policy on parental insurance for managerial employees in the benefits framework, scenario #2267?",Parents may be added to insurance by paying the applicable premium during the enrollment window in April.,Benefits
6,"What is the company policy on software installation for contract employees in our it & security framework, scenario #1828?","Only approved software may be installed, and requests should be raised through IT at least 3 day(s) in advance.",IT & Security
7,"What is the company policy on education support for sales employees in our benefits framework, scenario #8006?",Job-related certification reimbursement is capped at ₹500 per year after manager approval.,Benefits
8,"What is the company policy on sick leave for full-time employees in our leave policy framework, scenario #3471?","Sick leave entitlement is 30 days per year, and medical proof is required after 6 consecutive days of absence.",Leave Policy
9,"What is the company policy on usb policy for engineering employees in the it & security framework, scenario #965?",Use of personal USB devices on company systems is prohibited unless approved for up to 23 days.,IT & Security
10,"What is the company policy on salary revision for intern employees in our compensation framework, scenario #5805?",Salary revisions are normally effective from February based on performance and business conditions.,Compensation
11,"What is the company policy on rehire policy for probationary employees in our recruitment framework, scenario #7580?","Former employees may be considered for rehire after a cooling period of 15 months, subject to records review.",Recruitment
12,"What is the company policy on salary revision for full-time employees in our compensation framework, scenario #4346?",Salary revisions are normally effective from January based on performance and business conditions.,Compensation
13,"What is the company policy on dress code for managerial employees in the code of conduct framework, scenario #8321?",Employees are expected to follow formal dress standards on regular office days.,Code of Conduct
14,"What is the company policy on short breaks for intern employees in the attendance framework, scenario #4352?","Employees may take up to 3 short breaks per day, each not exceeding 10 minutes.",Attendance
15,"What is the company policy on document submission for engineering employees in the recruitment framework, scenario #6055?",New hires must submit all joining documents within 22 working days of the start date.,Recruitment
16,"What is the company policy on accident cover for full-time employees in the benefits framework, scenario #4326?",Accident insurance cover of ₹7500 is provided for employees on company rolls.,Benefits
17,"What is the company policy on software installation for support employees in the it & security framework, scenario #1833?","Only approved software may be installed, and requests should be raised through IT at least 9 day(s) in advance.",IT & Security
18,"What is the company policy on short breaks for contract employees in our attendance framework, scenario #2533?","Employees may take up to 18 short breaks per day, each not exceeding 1 minutes.",Attendance
19,"What is the company policy on bonus payout for contract employees in our compensation framework, scenario #5729?","Annual performance bonus, where applicable, is paid in January after review completion.",Compensation
20,"What is the company policy on wellness benefit for engineering employees in the benefits framework, scenario #1777?",Employees may claim wellness reimbursement of up to ₹2500 per year for approved activities.,Benefits
21,"What is the company policy on visa expense for probationary employees in our travel policy framework, scenario #2042?",Visa-related expenses for approved international travel are reimbursable through the standard expense process.,Travel Policy
22,"What is the company policy on access card for support employees in our workplace & facilities framework, scenario #9503?",Lost access cards must be reported within 17 hour(s) and replacement charges may apply.,Workplace & Facilities
23,"What is the company policy on per diem for intern employees in the travel policy framework, scenario #758?",Per diem for approved travel to category-1 locations is ₹50000 per day.,Travel Policy
24,"What is the company policy on travel allowance for intern employees in the compensation framework, scenario #9133?",Domestic business travel provides a daily allowance of ₹50000 for meals and local transport.,Compensation
25,"What is the company policy on salary revision for engineering employees in the compensation framework, scenario #4500?",Salary revisions are normally effective from November based on performance and business conditions.,Compensation
26,"What is the company policy on conflict of interest for engineering employees in our code of conduct framework, scenario #8891?",Potential conflicts of interest must be disclosed within 23 days of becoming known.,Code of Conduct
27,"What is the company policy on respectful behavior for full-time employees in our code of conduct framework, scenario #7957?","Abusive or threatening conduct toward colleagues, customers, or vendors is prohibited.",Code of Conduct
28,"What is the company policy on carry forward for contract employees in the leave policy framework, scenario #4263?","Up to 11 unused annual leave days may be carried forward, subject to manager approval by December.",Leave Policy
29,"What is the company policy on intern conversion for support employees in the recruitment framework, scenario #4052?",Intern-to-full-time conversion is evaluated during the final 7 weeks of internship.,Recruitment
30,"What is the company policy on salary payment for managerial employees in our compensation framework, scenario #9434?",Monthly salary is credited on the 20th working day of each month.,Compensation
31,"What is the company policy on garden leave for intern employees in our separation framework, scenario #208?",Garden leave may be applied during notice period based on business sensitivity and approval.,Separation
32,"What is the company policy on candidate travel for managerial employees in our recruitment framework, scenario #7386?",Interview travel reimbursement must be claimed within 4 days of the interview date.,Recruitment
33,"What is the company policy on travel allowance for full-time employees in the compensation framework, scenario #8465?",Domestic business travel provides a daily allowance of ₹20000 for meals and local transport.,Compensation
34,"What is the company policy on salary revision for intern employees in our compensation framework, scenario #9069?",Salary revisions are normally effective from August based on performance and business conditions.,Compensation
35,"What is the company policy on screen lock for engineering employees in the it & security framework, scenario #3546?",Devices must auto-lock after 14 minutes of inactivity.,IT & Security
36,"What is the company policy on emergency drill for sales employees in our workplace & facilities framework, scenario #2069?",Employees must participate in at least 9 emergency drill(s) per year where scheduled.,Workplace & Facilities
37,"What is the company policy on rehire restriction for managerial employees in the separation framework, scenario #2445?",Employees separated for misconduct may not be eligible for rehire under company policy.,Separation
38,"What is the company policy on local travel for support employees in the travel policy framework, scenario #3458?",Local travel claims must be submitted within 3 days and supported by receipts where required.,Travel Policy
39,"What is the company policy on parental insurance for probationary employees in the benefits framework, scenario #3825?",Parents may be added to insurance by paying the applicable premium during the enrollment window in September.,Benefits
40,"What is the company policy on employee assistance for intern employees in our benefits framework, scenario #6595?",The employee assistance program provides up to 22 confidential counseling sessions per year.,Benefits
41,"What is the company policy on festival gift for full-time employees in the benefits framework, scenario #7709?",A festival gift voucher of ₹50000 may be provided in February subject to company policy.,Benefits
42,"What is the company policy on software installation for support employees in our it & security framework, scenario #4723?","Only approved software may be installed, and requests should be raised through IT at least 30 day(s) in advance.",IT & Security
43,"What is the company policy on garden leave for probationary employees in our separation framework, scenario #7243?",Garden leave may be applied during notice period based on business sensitivity and approval.,Separation
44,"What is the company policy on maternity leave for managerial employees in the leave policy framework, scenario #1859?",Eligible employees may take 9 weeks of maternity leave in line with company policy and applicable law.,Leave Policy
45,"What is the company policy on conflict of interest for sales employees in the code of conduct framework, scenario #4527?",Potential conflicts of interest must be disclosed within 21 days of becoming known.,Code of Conduct
46,"What is the company policy on intern conversion for sales employees in the recruitment framework, scenario #9369?",Intern-to-full-time conversion is evaluated during the final 30 weeks of internship.,Recruitment
47,"What is the company policy on offer validity for managerial employees in our recruitment framework, scenario #252?",An employment offer is normally valid for 28 calendar days from the issue date.,Recruitment
48,"What is the company policy on canteen subsidy for managerial employees in the workplace & facilities framework, scenario #4709?",Eligible employees receive canteen subsidy of ₹1500 per working day.,Workplace & Facilities
49,"What is the company policy on salary revision for contract employees in the compensation framework, scenario #2786?",Salary revisions are normally effective from August based on performance and business conditions.,Compensation
50,"What is the company policy on home office for contract employees in the remote work framework, scenario #7238?",The company reimburses up to ₹3000 once every 20 months for approved home-office items.,Remote Work
51,"What is the company policy on attendance impact for sales employees in the performance management framework, scenario #6485?",Unresolved attendance issues over 10 instances in a quarter may affect performance discussions.,Performance Management
52,"What is the company policy on medical insurance for managerial employees in our benefits framework, scenario #7223?",Medical insurance cover of ₹750 is provided to eligible employees under the group policy.,Benefits
53,"What is the company policy on unpaid leave for sales employees in the leave policy framework, scenario #7674?",Unpaid leave beyond regular entitlement may be granted for up to 12 working days with management approval.,Leave Policy
54,"What is the company policy on short breaks for engineering employees in the attendance framework, scenario #3831?","Employees may take up to 25 short breaks per day, each not exceeding 4 minutes.",Attendance
55,"What is the company policy on harassment reporting for intern employees in the code of conduct framework, scenario #3847?",Workplace harassment concerns should be reported within 20 days to HR or the designated committee.,Code of Conduct
56,"What is the company policy on data classification for support employees in the it & security framework, scenario #5943?",Documents classified as Highly Sensitive may only be shared with authorized recipients.,IT & Security
57,"What is the company policy on shift allowance for support employees in the attendance framework, scenario #9081?",Employees assigned to the evening shift receive a shift allowance of ₹15000 per shift.,Attendance
58,"What is the company policy on relocation support for full-time employees in the compensation framework, scenario #9648?",Relocation assistance up to ₹10000 is available for approved transfers subject to bills within 7 days.,Compensation
59,"What is the company policy on review frequency for support employees in our performance management framework, scenario #511?",Performance reviews are conducted annually and documented in the HR system.,Performance Management
60,"What is the company policy on leave encashment for probationary employees in our leave policy framework, scenario #9788?",Employees may encash up to 28 unused leave days at year-end if approved by HR and Finance.,Leave Policy
61,"What is the company policy on email retention for probationary employees in our it & security framework, scenario #5121?",Official email records are retained for approximately 15 months in line with policy.,IT & Security
62,"What is the company policy on full and final settlement for probationary employees in our separation framework, scenario #6930?",Full and final settlement is generally processed within 12 days after separation documentation is complete.,Separation
63,"What is the company policy on desk allocation for probationary employees in our workplace & facilities framework, scenario #9191?",Desk allocation is managed by Facilities and may change based on seating plans and team movement.,Workplace & Facilities
64,"What is the company policy on travel advance for sales employees in the travel policy framework, scenario #2325?",Travel advance requests must be raised at least 22 working days before the trip.,Travel Policy
65,"What is the company policy on desk allocation for support employees in the workplace & facilities framework, scenario #1337?",Desk allocation is managed by Facilities and may change based on seating plans and team movement.,Workplace & Facilities
66,"What is the company policy on childcare support for managerial employees in our benefits framework, scenario #745?",Eligible employees may claim childcare support up to ₹100000 per month for children up to age 22.,Benefits
67,"What is the company policy on overtime pay for sales employees in the compensation framework, scenario #8197?",Eligible employees receive overtime at 2.0x the hourly rate for approved extra hours.,Compensation
68,"What is the company policy on screen lock for full-time employees in the it & security framework, scenario #7539?",Devices must auto-lock after 3 minutes of inactivity.,IT & Security
69,"What is the company policy on meeting room for support employees in the workplace & facilities framework, scenario #5725?",Meeting rooms should be released if unused for more than 3 minutes after booking time.,Workplace & Facilities
70,"What is the company policy on rating appeal for intern employees in our performance management framework, scenario #2474?",Rating appeal requests must be submitted within 8 working days of receiving the appraisal outcome.,Performance Management
71,"What is the company policy on conflict of interest for full-time employees in our code of conduct framework, scenario #7582?",Potential conflicts of interest must be disclosed within 16 days of becoming known.,Code of Conduct
72,"What is the company policy on weekend stay for intern employees in the travel policy framework, scenario #4060?",Extended weekend stay during business travel requires cost comparison and manager approval.,Travel Policy
73,"What is the company policy on emergency drill for contract employees in our workplace & facilities framework, scenario #4656?",Employees must participate in at least 15 emergency drill(s) per year where scheduled.,Workplace & Facilities
74,"What is the company policy on employee assistance for contract employees in the benefits framework, scenario #6938?",The employee assistance program provides up to 28 confidential counseling sessions per year.,Benefits
75,"What is the company policy on screen lock for intern employees in our it & security framework, scenario #2148?",Devices must auto-lock after 1 minutes of inactivity.,IT & Security
76,"What is the company policy on visa expense for contract employees in our travel policy framework, scenario #7685?",Visa-related expenses for approved international travel are reimbursable through the standard expense process.,Travel Policy
77,"What is the company policy on expense reimbursement for sales employees in the compensation framework, scenario #4671?",Approved expense claims must be submitted within 22 days of the expense date.,Compensation
78,"What is the company policy on short breaks for support employees in our attendance framework, scenario #3679?","Employees may take up to 9 short breaks per day, each not exceeding 8 minutes.",Attendance
79,"What is the company policy on bereavement leave for contract employees in our leave policy framework, scenario #1822?",Employees may take 30 working days of bereavement leave for immediate family members.,Leave Policy
80,"What is the company policy on wellness benefit for support employees in our benefits framework, scenario #3942?",Employees may claim wellness reimbursement of up to ₹750 per year for approved activities.,Benefits
81,"What is the company policy on visa expense for engineering employees in the travel policy framework, scenario #1699?",Visa-related expenses for approved international travel are reimbursable through the standard expense process.,Travel Policy
82,"What is the company policy on per diem for engineering employees in the travel policy framework, scenario #3269?",Per diem for approved travel to category-1 locations is ₹15000 per day.,Travel Policy
83,"What is the company policy on bereavement leave for managerial employees in our leave policy framework, scenario #6554?",Employees may take 30 working days of bereavement leave for immediate family members.,Leave Policy
84,"What is the company policy on emergency drill for managerial employees in the workplace & facilities framework, scenario #1312?",Employees must participate in at least 29 emergency drill(s) per year where scheduled.,Workplace & Facilities
85,"What is the company policy on promotion review for managerial employees in the performance management framework, scenario #2340?","Promotion nominations are reviewed in March based on performance, readiness, and budget.",Performance Management
86,"What is the company policy on travel insurance for engineering employees in our travel policy framework, scenario #6522?",Travel insurance is mandatory for all approved international business trips.,Travel Policy
87,"What is the company policy on promotion review for contract employees in the performance management framework, scenario #2224?","Promotion nominations are reviewed in December based on performance, readiness, and budget.",Performance Management
88,"What is the company policy on weekend work for engineering employees in the attendance framework, scenario #3293?",Weekend work requires prior approval from the reporting manager and must be logged within 6 hours.,Attendance
89,"What is the company policy on remote availability for engineering employees in the remote work framework, scenario #2054?",Employees working remotely must be reachable between 8:00 PM and 5:30 PM on official communication channels.,Remote Work
90,"What is the company policy on goal setting for contract employees in our performance management framework, scenario #8502?",Employees must finalize annual goals within 15 days of the performance cycle start.,Performance Management
91,"What is the company policy on parental insurance for contract employees in our benefits framework, scenario #3454?",Parents may be added to insurance by paying the applicable premium during the enrollment window in May.,Benefits
92,"What is the company policy on visa expense for sales employees in our travel policy framework, scenario #7610?",Visa-related expenses for approved international travel are reimbursable through the standard expense process.,Travel Policy
93,"What is the company policy on expense reimbursement for engineering employees in the compensation framework, scenario #2309?",Approved expense claims must be submitted within 20 days of the expense date.,Compensation
94,"What is the company policy on working hours for contract employees in our attendance framework, scenario #3945?",Standard working hours are 6:00 PM to 7:00 PM with a 30-minute meal break.,Attendance
95,"What is the company policy on relocation support for managerial employees in our compensation framework, scenario #839?",Relocation assistance up to ₹750 is available for approved transfers subject to bills within 12 days.,Compensation
96,"What is the company policy on weekend stay for probationary employees in the travel policy framework, scenario #3262?",Extended weekend stay during business travel requires cost comparison and manager approval.,Travel Policy
97,"What is the company policy on weekend stay for full-time employees in our travel policy framework, scenario #8312?",Extended weekend stay during business travel requires cost comparison and manager approval.,Travel Policy
98,"What is the company policy on mfa requirement for full-time employees in the it & security framework, scenario #9561?",Multi-factor authentication is mandatory for access to all critical systems.,IT & Security
99,"What is the company policy on gifts policy for intern employees in our code of conduct framework, scenario #1021?",Employees may not accept gifts above ₹20000 without written approval.,Code of Conduct
100,"What is the company policy on canteen subsidy for managerial employees in the workplace & facilities framework, scenario #4572?",Eligible employees receive canteen subsidy of ₹500000 per working day.,Workplace & Facilities
101,"What is the company policy on email retention for intern employees in our it & security framework, scenario #690?",Official email records are retained for approximately 8 months in line with policy.,IT & Security
102,"What is the company policy on parental insurance for managerial employees in the benefits framework, scenario #861?",Parents may be added to insurance by paying the applicable premium during the enrollment window in December.,Benefits
103,"What is the company policy on night shift for contract employees in the attendance framework, scenario #8768?",Night shift is defined as work performed between 8:00 AM and 5:30 PM.,Attendance
104,"What is the company policy on desk allocation for full-time employees in our workplace & facilities framework, scenario #2199?",Desk allocation is managed by Facilities and may change based on seating plans and team movement.,Workplace & Facilities
105,"What is the company policy on software installation for contract employees in our it & security framework, scenario #8443?","Only approved software may be installed, and requests should be raised through IT at least 9 day(s) in advance.",IT & Security
106,"What is the company policy on goal setting for contract employees in our performance management framework, scenario #5891?",Employees must finalize annual goals within 13 days of the performance cycle start.,Performance Management
107,"What is the company policy on visitor policy for sales employees in the workplace & facilities framework, scenario #7455?",Visitors must be registered at reception and hosted by an employee at all times.,Workplace & Facilities
108,"What is the company policy on clean desk for intern employees in the workplace & facilities framework, scenario #2696?",Employees must clear sensitive papers from desks before leaving for the day.,Workplace & Facilities
109,"What is the company policy on reward nomination for managerial employees in the performance management framework, scenario #6488?",Spot award nominations should be submitted within 15 days of the recognized contribution.,Performance Management
110,"What is the company policy on medical insurance for support employees in our benefits framework, scenario #6267?",Medical insurance cover of ₹1000 is provided to eligible employees under the group policy.,Benefits
111,"What is the company policy on respectful behavior for engineering employees in our code of conduct framework, scenario #3763?","Abusive or threatening conduct toward colleagues, customers, or vendors is prohibited.",Code of Conduct
112,"What is the company policy on travel allowance for probationary employees in the compensation framework, scenario #725?",Domestic business travel provides a daily allowance of ₹5000 for meals and local transport.,Compensation
113,"What is the company policy on candidate travel for contract employees in our recruitment framework, scenario #4924?",Interview travel reimbursement must be claimed within 8 days of the interview date.,Recruitment
